{idt},{QuestionText},{FK_QuestionType},{CTRLCODE},metric,20,{sortpos},{identifier_text},{PK_Question}
12.," To what extent does the organization use an organization wide SCRM strategy to manage the supply chain risks associated with the development, acquisition, maintenance, and disposal of systems, system components, and system services? (NIST SP 800-53 (Rev. 5): PM-30, SR-1, and SR-2; NIST SP 800-161 (Rev. 1); NIST IR 8276; The Federal Acquisition Supply Chain Security Act of 2018 (H.R. 7327, 41 USC Chap. 13, Sub chap. III and Chap. 47, P.L. 115-390); National Counterintelligence Strategy; OMB M-22-18)?",2,CNT,"<p><em>12. To what extent does the organization use an organization wide SCRM strategy to manage the supply chain risks associated with the development, acquisition, maintenance, and disposal of systems, system components, and system services? (NIST SP 800-53 (Rev. 5): PM-30, SR-1, and SR-2; NIST SP 800-161 (Rev. 1); NIST IR 8276; The Federal Acquisition Supply Chain Security Act of 2018 (H.R. 7327, 41 USC Chap. 13, Sub chap. III and Chap. 47, P.L. 115-390); National Counterintelligence Strategy; OMB M-22-18)?</em></p>",<p><em>12. T,1,12.,53260
13., To what extent does the organization use SCRM policies and procedures to manage SCRM activities at all organizational tiers (NIST SP 800-53 (Rev. 5): SR-1; NIST SP 800-161 (Rev. 1); NIST CSF: ID.SC-1 and ID.SC-5; NIST IR 7622; NIST IR 8276; NIST IR 8419; The Federal Acquisition Supply Chain Security Act of 2018; DHSs ICT Supply Chain Library; Securing the Software Supply Chain; OMB M-22-18)?,9,TXT,<p><em>13.  To what extent does the organization use SCRM policies and procedures to manage SCRM activities at all organizational tiers (NIST SP 800-53 (Rev. 5): SR-1; NIST SP 800-161 (Rev. 1); NIST CSF: ID.SC-1 and ID.SC-5; NIST IR 7622; NIST IR 8276; NIST IR 8419; The Federal Acquisition Supply Chain Security Act of 2018; DHS’s ICT Supply Chain Library; Securing the Software Supply Chain; OMB M-22-18)?</em></p>,<p><em>13.  ,2,13.,53261
14.," To what extent does the organization ensure that products, system components, systems, and services of external providers are consistent with the organizations cybersecurity and supply chain requirements (NIST SP 800-53 (Rev. 5): SA-4, SR-3, SR-5, and SR-6; NIST SP 800-152; NIST SP 800-161 (Rev. 1); NIST SP 800-218: Task PO.1.3; NIST IR 8276; NIST CSF: ID.SC-2 through ID.SC-4; OMB A-130; OMB M-19-03; OMB M-22-18; CIS Top 18 Security Controls: Control 15; The Federal Acquisition Supply Chain Security Act of 2018; FedRAMP standard contract clauses; Cloud computing contract best practices; DHSs ICT Supply Chain Library)?",9,TXT,"<p><b>14. To what extent does the organization ensure that products, system components, systems, and services of external providers are consistent with the organization’s cybersecurity and supply chain requirements (NIST SP 800-53 (Rev. 5): SA-4, SR-3, SR-5, and SR-6; NIST SP 800-152; NIST SP 800-161 (Rev. 1); NIST SP 800-218: Task PO.1.3; NIST IR 8276; NIST CSF: ID.SC-2 through ID.SC-4; OMB A-130; OMB M-19-03; OMB M-22-18; CIS Top 18 Security Controls: Control 15; The Federal Acquisition Supply Chain Security Act of 2018; FedRAMP standard contract clauses; Cloud computing contract best practices; DHS’s ICT Supply Chain Library)?</b></p>",<p><b>14. To,3,14.,53262
15., To what extent does the organization ensure that counterfeit components are detected and prevented from entering the organizations systems (NIST SP 800-53 (Rev. 5): SR-11 (1)(2); NIST SP 800-161 (Rev. 1); OMB M-22-18; NIST SP 800-218)?,2,CNT,<p>15. To what extent does the organization ensure that counterfeit components are detected and prevented from entering the organization’s systems (NIST SP 800-53 (Rev. 5): SR-11 (1)(2); NIST SP 800-161 (Rev. 1); OMB M-22-18; NIST SP 800-218)?</p>,<p>15. To wh,4,15.,53263
16.3, Please provide the assessed maturity level for the agency's Identify - Supply Chain Risk Management program.,17,PICK,<p>16.3 Please provide the assessed maturity level for the agency's Identify - Supply Chain Risk Management program.</p>,<p>16.3 Plea,5,16.3,53264
16.2, Please provide the assessed maturity level for the agency's Protect Function.,17,PICK,<p>16.2 Please provide the assessed maturity level for the agency's Protect Function.</p>,<p>16.2 Plea,6,16.2,53265
16.3," Provide any additional information on the effectiveness (positive or negative) of the organizations supply chain risk management program that was not noted in the questions above. Taking into consideration the overall maturity level generated from the questions above and based on all testing performed, is the risk management program effective?",17,PICK,"<p>16.3 Provide any additional information on the effectiveness (positive or negative) of the organization’s supply chain risk management program that was not noted in the questions above. Taking into consideration the overall maturity level generated from the questions above and based on all testing performed, is the risk management program effective?</p>",<p>16.3 Prov,7,16.3,53266
