{idt},{QuestionText},{FK_QuestionType},{CTRLCODE},metric,20,{sortpos},{identifier_text},{PK_Question}
52.," To what extent does the organization use an incident response plan to provide a formal, focused, and coordinated approach to responding to incidents (NIST SP 800-53 (Rev. 5): IR-8; NIST SP 800-61 (Rev. 2): Section 2.3.2; NIST CSF: RS.RP1; Presidential Policy Directive (PPD) 8  National Preparedness; FY 2023 CIO FISMA Metrics: 10.1.1; FY 2022 CIO FISMA Metrics: 10.6)?",9,TXT,"<p>52. To what extent does the organization use an incident response plan to provide a formal, focused, and coordinated approach to responding to incidents (NIST SP 800-53 (Rev. 5): IR-8; NIST SP 800-61 (Rev. 2): Section 2.3.2; NIST CSF: RS.RP1; Presidential Policy Directive (PPD) 8 – National Preparedness; FY 2023 CIO FISMA Metrics: 10.1.1; FY 2022 CIO FISMA Metrics: 10.6)?</p>",<p>52. To wh,1,52.,53260
53.," To what extent have incident response team structures/models, stakeholders, and their roles, responsibilities, levels of authority, and dependencies been defined, communicated, and implemented across the organization (NIST SP 800-53 (Rev. 5) IR-7; NIST SP 800-61 (Rev. 2); NIST SP 800-83; NIST CSF: RS.CO1; OMB M-20-04; US-CERT Federal Incident Notification Guidelines; Green Book: Principles 3, 4, and 5)?",9,TXT,"<p>53. To what extent have incident response team structures/models, stakeholders, and their roles, responsibilities, levels of authority, and dependencies been defined, communicated, and implemented across the organization (NIST SP 800-53 (Rev. 5) IR-7; NIST SP 800-61 (Rev. 2); NIST SP 800-83; NIST CSF: RS.CO1; OMB M-20-04; US-CERT Federal Incident Notification Guidelines; Green Book: Principles 3, 4, and 5)?</p>",<p>53. To wh,2,53.,53261
54.," How mature are the organization's processes for incident detection and analysis (NIST SP 800-53 (Rev. 5): IR-4, IR-5, and IR-6; NIST SP 800-61 (Rev. 2); NIST CSF: DE.AE1 -5, PR.DS-6, RS.AN-1, RS.AN-4, and PR.DS-8; OMB M-20-04; OMB M-21-31; OMB M-22-01; OMB M-23-03; CISA Cybersecurity Incident Response Playbooks; CIS Top 18 Security Controls: Control 17; US-CERT Federal Incident Notification Guidelines; FY 2023 CIO FISMA Metrics: 3.1, 10.4, 10.5, and 10.6)?{}",2,CNT,"<p><b>54.</b>  <b>How mature are the organization's processes for incident detection and analysis (NIST SP 800-53 (Rev. 5): IR-4, IR-5, and IR-6; NIST SP 800-61 (Rev. 2); NIST CSF: DE.AE1 -5, PR.DS-6, RS.AN-1, RS.AN-4, and PR.DS-8; OMB M-20-04; OMB M-21-31; OMB M-22-01; OMB M-23-03; CISA Cybersecurity Incident Response Playbooks; CIS Top 18 Security Controls: Control 17; US-CERT Federal Incident Notification Guidelines; FY 2023 CIO FISMA Metrics: 3.1, 10.4, 10.5, and 10.6)?</b><b>{</b>}</p>",<p><b>54.</b,3,54.,53262
55.," How mature are the organization's processes for incident handling (NIST SP 800-53 (Rev. 5): IR-4; NIST SP 800-61 (Rev. 2); NIST IR 8374; NIST CSF: RS.MI1 and RS.MI-2; OMB M-21-31; OMB M-23-03; CISA Cybersecurity Incident Response Playbooks; FY 2023 CIO FISMA Metrics: 10.4, 10.5, and 10.6)?",2,CNT,"<p><b>55. How mature are the organization's processes for incident handling (NIST SP 800-53 (Rev. 5): IR-4; NIST SP 800-61 (Rev. 2); NIST IR 8374; NIST CSF: RS.MI1 and RS.MI-2; OMB M-21-31; OMB M-23-03; CISA Cybersecurity Incident Response Playbooks; FY 2023 CIO FISMA Metrics: 10.4, 10.5, and 10.6)?</b></p>",<p><b>55. Ho,4,55.,53263
56., To what extent does the organization ensure that incident response information is shared with individuals with significant security responsibilities and reported to external stakeholders in a timely manner (FISMA; NIST SP 800-53 (Rev. 5): IR-6; NIST CSF: RS.CO2 through RS.CO-5; OMB M-20-04; US-CERT Federal Incident Notification Guidelines; PPD-41; DHS Cyber Incident Reporting Unified Message)?,9,TXT,<p>56. To what extent does the organization ensure that incident response information is shared with individuals with significant security responsibilities and reported to external stakeholders in a timely manner (FISMA; NIST SP 800-53 (Rev. 5): IR-6; NIST CSF: RS.CO2 through RS.CO-5; OMB M-20-04; US-CERT Federal Incident Notification Guidelines; PPD-41; DHS Cyber Incident Reporting Unified Message)?</p>,<p>56. To wh,5,56.,53264
57.," To what extent does the organization collaborate with stakeholders to ensure on-site, technical assistance/surge capabilities can be leveraged for quickly responding to incidents, including through contracts/agreements, as appropriate, for incident response support (NIST SP 800-53 (Rev. 5): IR-4; NIST SP 800-86; OMB M-20-04; PPD-41; NCPS Cloud Interface Reference Architecture)?",9,TXT,"<p><em>57. To what extent does the organization collaborate with stakeholders to ensure on-site, technical assistance/surge capabilities can be leveraged for quickly responding to incidents, including through contracts/agreements, as appropriate, for incident response support (NIST SP 800-53 (Rev. 5): IR-4; NIST SP 800-86; OMB M-20-04; PPD-41; NCPS Cloud Interface Reference Architecture)?</em></p>",<p><em>57. T,6,57.,53265
58., To what extent does the organization use the following technology to support its incident response program (NIST SP 800-44; NIST SP 800-61 (Rev. 2); NIST SP 800-137; OMB M-22-01; OMB M-22-09)?,9,TXT,<p><em>58. To what extent does the organization use the following technology to support its incident response program (NIST SP 800-44; NIST SP 800-61 (Rev. 2); NIST SP 800-137; OMB M-22-01; OMB M-22-09)?</em></p>,<p><em>58. T,7,58.,53266
59.1, Please provide the assessed maturity level for the agency's Respond - Incident Response function.,17,PICK,<p>59.1 Please provide the assessed maturity level for the agency's Respond - Incident Response function.</p>,<p>59.1 Plea,8,59.1,53267
59.2," Provide any additional information on the effectiveness (positive or negative) of the organizations incident response program that was not noted in the questions above. Taking into consideration the maturity level generated from the questions above and based on all testing performed, is the incident response program effective?",17,PICK,"<p>59.2 Provide any additional information on the effectiveness (positive or negative) of the organization’s incident response program that was not noted in the questions above. Taking into consideration the maturity level generated from the questions above and based on all testing performed, is the incident response program effective?</p>",<p>59.2 Prov,9,59.2,53268
